"Status","Start Time","Stop Time","Duration in ms","Parent Suite","Suite","Sub Suite","Test Class","Test Method","Name","Description"
"broken","Fri Mar 31 11:27:59 ICT 2023","Fri Mar 31 11:28:33 ICT 2023","34153","Regression","Global Search","testcases.web.global_search.GlobalSearch","testcases.web.global_search.GlobalSearch","TC_05","Verify user can search drivers by email","Verify user can search drivers by email"
"broken","Fri Mar 31 11:14:43 ICT 2023","Fri Mar 31 11:15:19 ICT 2023","35882","Regression","Permission","testcases.web.permission.Permission","testcases.web.permission.Permission","TC_34","Verify System Write should not be able to delete a user that belongs to the 'Administrators' group","Verify System Write should not be able to delete a user that belongs to the 'Administrators' group"
"broken","Fri Mar 31 11:10:03 ICT 2023","Fri Mar 31 11:10:39 ICT 2023","36010","Regression","Permission","testcases.web.permission.Permission","testcases.web.permission.Permission","TC_01","Verify System Write user can view the 'Dashboard' page","Verify System Write user can view the 'Dashboard' page"
"broken","Fri Mar 31 10:57:57 ICT 2023","Fri Mar 31 10:57:57 ICT 2023","0","Regression","Regions","testcases.web.region.RegionListing","testcases.web.region.RegionListing","beforeEachScenario","beforeEachScenario",""
"broken","Fri Mar 31 11:12:01 ICT 2023","Fri Mar 31 11:12:37 ICT 2023","35933","Regression","Permission","testcases.web.permission.Permission","testcases.web.permission.Permission","TC_11","Verify Configuration Write user can not view Driver","Verify Configuration Write user can not view Driver"
"broken","Fri Mar 31 11:12:05 ICT 2023","Fri Mar 31 11:12:42 ICT 2023","37068","Regression","Permission","testcases.web.permission.Permission","testcases.web.permission.Permission","TC_16","Verify Configuration Read user can not view Service Monitoring","Verify Configuration Read user can not view Service Monitoring"
"broken","Fri Mar 31 11:16:00 ICT 2023","Fri Mar 31 11:16:35 ICT 2023","35950","Regression","Permission","testcases.web.permission.Permission","testcases.web.permission.Permission","TC_48","Verify Configuration Write user can design zone","Verify Configuration Write design zone"
"broken","Fri Mar 31 11:11:24 ICT 2023","Fri Mar 31 11:12:01 ICT 2023","37108","Regression","Permission","testcases.web.permission.Permission","testcases.web.permission.Permission","TC_17","Verify System Read user can not view Travellers","Verify System Read user can not view Travellers"
"passed","Fri Mar 31 10:52:22 ICT 2023","Fri Mar 31 10:52:40 ICT 2023","18318","Regression","Users","testcases.web.user.UsersCreating","testcases.web.user.UsersCreating","TC_11","Verify user can not create new user with existed user name","The Username should have a unique constraint against it so the application should never allow a user to create more than one user with the same username"
"unknown","Fri Mar 31 10:51:16 ICT 2023","Fri Mar 31 10:51:16 ICT 2023","0","Regression","Users","testcases.web.user.UsersEditing","testcases.web.user.UsersEditing","TC_12","TC_12",""
"passed","Fri Mar 31 11:27:59 ICT 2023","Fri Mar 31 11:28:06 ICT 2023","6554","Regression","Global Search","testcases.web.global_search.GlobalSearch","testcases.web.global_search.GlobalSearch","TC_09","Verify user can search vehicle trip by name","Verify user can search vehicle trip by name"
"broken","Fri Mar 31 11:10:44 ICT 2023","Fri Mar 31 11:11:21 ICT 2023","36652","Regression","Permission","testcases.web.permission.Permission","testcases.web.permission.Permission","TC_16","Verify System Write user can not view Service Monitoring","Verify System Write user can not view Service Monitoring"
"broken","Fri Mar 31 11:16:05 ICT 2023","Fri Mar 31 11:16:41 ICT 2023","36039","Regression","Permission","testcases.web.permission.Permission","testcases.web.permission.Permission","TC_51","Verify Configuration Read user can not delete region","Verify Configuration Read user can not delete region"
"passed","Fri Mar 31 10:51:18 ICT 2023","Fri Mar 31 10:51:51 ICT 2023","33409","Regression","Users","testcases.web.user.UsersEditing","testcases.web.user.UsersEditing","TC_01","Verify administrator can edit user successfully with valid information","Verify administrator can edit user successfully with valid information"
"broken","Fri Mar 31 11:14:05 ICT 2023","Fri Mar 31 11:14:41 ICT 2023","35863","Regression","Permission","testcases.web.permission.Permission","testcases.web.permission.Permission","TC_30","Verify System Write user can create new User Group","Verify System Write user can create new User Group"
"skipped","Fri Mar 31 10:58:38 ICT 2023","Fri Mar 31 10:58:38 ICT 2023","0","Regression","Zones","testcases.web.zone.ZoneListing","testcases.web.zone.ZoneListing","TC_05","TC_05",""
"broken","Fri Mar 31 11:12:29 ICT 2023","Fri Mar 31 11:13:05 ICT 2023","35986","Regression","Permission","testcases.web.permission.Permission","testcases.web.permission.Permission","TC_13","Verify Configuration Write user can not view Vehicles","Verify Configuration Write user can not view Vehicles"
"passed","Fri Mar 31 11:27:59 ICT 2023","Fri Mar 31 11:28:08 ICT 2023","9326","Regression","Global Search","testcases.web.global_search.GlobalSearch","testcases.web.global_search.GlobalSearch","TC_07","Verify user can search passengers by user name","Verify user can search passengers by user name"
"broken","Fri Mar 31 11:03:06 ICT 2023","Fri Mar 31 11:04:50 ICT 2023","104363","Regression","Booking Flow","testcases.web.booking_flow.BookingFlow","testcases.web.booking_flow.BookingFlow","TC_06","Verify user can book a trip by using credit card","Verify user can book a trip by using credit card"
"passed","Fri Mar 31 10:52:09 ICT 2023","Fri Mar 31 10:52:27 ICT 2023","18182","Regression","Users","testcases.web.user.UsersCreating","testcases.web.user.UsersCreating","TC_07","Verify can not create user without enter mandatory field 'Username'","Verify can not create user without enter mandatory field 'Username'"
"passed","Fri Mar 31 10:53:45 ICT 2023","Fri Mar 31 10:53:51 ICT 2023","5789","Regression","Groups","testcases.web.group.GroupCreating","testcases.web.group.GroupCreating","TC_01","Verify can create group with no role and no user","Verify can create group with no roles"
"passed","Fri Mar 31 11:01:26 ICT 2023","Fri Mar 31 11:01:55 ICT 2023","29906","Regression","Drivers","testcases.web.driver.DriverEditing","testcases.web.driver.DriverEditing","TC_06","Verify edit driver failed if does not enter user name","Verify edit driver failed if does not enter user name"
"broken","Fri Mar 31 11:12:42 ICT 2023","Fri Mar 31 11:13:19 ICT 2023","36244","Regression","Permission","testcases.web.permission.Permission","testcases.web.permission.Permission","TC_22","Verify Reporting user can not view User Group","Verify Reporting user can not view User Group"
"broken","Fri Mar 31 11:09:19 ICT 2023","Fri Mar 31 11:09:56 ICT 2023","37514","Regression","Permission","testcases.web.permission.Permission","testcases.web.permission.Permission","TC_02","Verify Reporting  user can view the 'Feedback' page","Verify Reporting user can view the 'Feedback' page"
"passed","Fri Mar 31 11:01:26 ICT 2023","Fri Mar 31 11:01:56 ICT 2023","29504","Regression","Drivers","testcases.web.driver.DriverEditing","testcases.web.driver.DriverEditing","TC_07","Verify edit driver failed if does not enter email","Verify edit driver failed if does not enter email"
"passed","Fri Mar 31 11:02:05 ICT 2023","Fri Mar 31 11:02:10 ICT 2023","4882","Regression","Drivers","testcases.web.driver.DriversListing","testcases.web.driver.DriversListing","TC_03","Verify can select number of row per page","Verify user can select number of row per page"
"broken","Fri Mar 31 11:09:58 ICT 2023","Fri Mar 31 11:10:34 ICT 2023","35838","Regression","Permission","testcases.web.permission.Permission","testcases.web.permission.Permission","TC_13","Verify Reporting user can not view Vehicles","Verify Reporting user can not view Vehicles"
"passed","Fri Mar 31 10:44:42 ICT 2023","Fri Mar 31 10:44:46 ICT 2023","3835","Regression","Login","testcases.web.Login","testcases.web.Login","TC_Login_02","Verify login failed by invalid account with 'wrong password'","Verify user login unsuccessfully with wrong password':
Email: daohuyt@bridj.com
 Password: wrong_pass"
"broken","Fri Mar 31 10:51:56 ICT 2023","Fri Mar 31 10:52:32 ICT 2023","36221","Regression","Users","testcases.web.user.UsersCreating","testcases.web.user.UsersCreating","TC_03","Verify user without administrator role can not add user to Administrators Group","Verify user without administrator role can not add user to Administrators Group"
"broken","Fri Mar 31 11:03:06 ICT 2023","Fri Mar 31 11:04:52 ICT 2023","106316","Regression","Booking Flow","testcases.web.booking_flow.BookingFlow","testcases.web.booking_flow.BookingFlow","TC_08","Verify user can book a trip with Wheelchair space","Verify user can book a trip with Wheelchair space"
"passed","Fri Mar 31 10:53:43 ICT 2023","Fri Mar 31 10:54:04 ICT 2023","20055","Regression","Groups","testcases.web.group.GroupEditing","testcases.web.group.GroupEditing","TC_01","Verify can edit group with no roles and no users","Verify can edit group with no roles and no users"
"broken","Fri Mar 31 11:15:25 ICT 2023","Fri Mar 31 11:16:01 ICT 2023","36088","Regression","Permission","testcases.web.permission.Permission","testcases.web.permission.Permission","TC_43","Verify Configuration Write user can edit region","Verify Configuration Write user can edit region"
"broken","Fri Mar 31 11:26:08 ICT 2023","Fri Mar 31 11:26:08 ICT 2023","0","Regression","Service Monitoring","testcases.web.service_monitoring.ServiceMonitoring","testcases.web.service_monitoring.ServiceMonitoring","beforeSuite","beforeSuite",""
"skipped","Fri Mar 31 10:57:57 ICT 2023","Fri Mar 31 10:57:57 ICT 2023","0","Regression","Regions","testcases.web.region.RegionListing","testcases.web.region.RegionListing","TC_03","TC_03",""
"passed","Fri Mar 31 11:01:06 ICT 2023","Fri Mar 31 11:01:17 ICT 2023","10561","Regression","Drivers","testcases.web.driver.DriverCreating","testcases.web.driver.DriverCreating","TC_02","Verify create driver failed with exist user name","Verify create driver failed with exist user name"
"passed","Fri Mar 31 10:51:13 ICT 2023","Fri Mar 31 10:51:13 ICT 2023","545","Regression","Dashboard","testcases.web.dashboard.DashBoard","testcases.web.dashboard.DashBoard","TC_01","Verify can access Regions page from Dashboard ","Verify can access Regions page from Dashboard"
"skipped","Fri Mar 31 11:26:17 ICT 2023","Fri Mar 31 11:26:17 ICT 2023","0","Regression","Service Monitoring","testcases.web.service_monitoring.ServiceMonitoring","testcases.web.service_monitoring.ServiceMonitoring","TC_02","TC_02",""
"skipped","Fri Mar 31 11:26:18 ICT 2023","Fri Mar 31 11:26:18 ICT 2023","0","Regression","Service Monitoring","testcases.web.service_monitoring.ServiceMonitoring","testcases.web.service_monitoring.ServiceMonitoring","TC_07","TC_07",""
"broken","Fri Mar 31 10:51:20 ICT 2023","Fri Mar 31 10:52:01 ICT 2023","40492","Regression","Users","testcases.web.user.UsersEditing","testcases.web.user.UsersEditing","TC_03","Verify user without administrator role can not add user to administrator group","Verify user without administrator role can not add user to administrator group"
"broken","Fri Mar 31 11:00:37 ICT 2023","Fri Mar 31 11:00:37 ICT 2023","0","Regression","Zones","testcases.web.zone.ZoneListing","testcases.web.zone.ZoneListing","beforeEachScenario","beforeEachScenario",""
"unknown","Fri Mar 31 10:51:16 ICT 2023","Fri Mar 31 10:51:16 ICT 2023","0","Regression","Users","testcases.web.user.UsersCreating","testcases.web.user.UsersCreating","TC_12","TC_12",""
"broken","Fri Mar 31 11:14:40 ICT 2023","Fri Mar 31 11:15:16 ICT 2023","35889","Regression","Permission","testcases.web.permission.Permission","testcases.web.permission.Permission","TC_20","Verify Configuration Read user can not view Solutions","Verify Configuration Read user can not view Solutions"
"passed","Fri Mar 31 10:54:16 ICT 2023","Fri Mar 31 10:54:52 ICT 2023","36062","Regression","Passenger","testcases.web.passenger.PassengerEditing","testcases.web.passenger.PassengerEditing","TC_08","Verify user can add Concession: Vision Impaired for passengers","Verify user can add Concession: Vision Impaired for passengers"
"broken","Fri Mar 31 11:12:42 ICT 2023","Fri Mar 31 11:13:14 ICT 2023","32814","Regression","Permission","testcases.web.permission.Permission","testcases.web.permission.Permission","TC_21","Verify Reporting user can not view Users","Verify Reporting user can not view Users"
"broken","Fri Mar 31 11:12:05 ICT 2023","Fri Mar 31 11:12:42 ICT 2023","37100","Regression","Permission","testcases.web.permission.Permission","testcases.web.permission.Permission","TC_17","Verify Configuration Read user can not view Travellers","Verify Configuration Read user can not view Travellers"
"passed","Fri Mar 31 11:28:14 ICT 2023","Fri Mar 31 11:28:19 ICT 2023","5594","Regression","Global Search","testcases.web.global_search.GlobalSearch","testcases.web.global_search.GlobalSearch","TC_14","Verify user can search vehicle by model","Verify user can search vehicle by model"
"passed","Fri Mar 31 11:01:05 ICT 2023","Fri Mar 31 11:01:28 ICT 2023","23118","Regression","Drivers","testcases.web.driver.DriverDeleting","testcases.web.driver.DriverDeleting","TC_01","Verify can delete driver successfully","Verify delete driver successfully"
"passed","Fri Mar 31 11:27:59 ICT 2023","Fri Mar 31 11:28:08 ICT 2023","9005","Regression","Global Search","testcases.web.global_search.GlobalSearch","testcases.web.global_search.GlobalSearch","TC_06","Verify user can search passengers by name","Verify user can search passengers by name"
"broken","Fri Mar 31 10:45:24 ICT 2023","Fri Mar 31 10:46:00 ICT 2023","35882","Regression","Login","testcases.web.Login","testcases.web.Login","TC_Login_01","Verify login successfully with ''","Verify login successfully with 
Email: systemread09@gmail.com
 Password: userPass@123"
"broken","Fri Mar 31 11:14:40 ICT 2023","Fri Mar 31 11:15:16 ICT 2023","35923","Regression","Permission","testcases.web.permission.Permission","testcases.web.permission.Permission","TC_25","Verify Configuration Read user can not view Trips","Verify Configuration Read user can not view Trips"
"skipped","Fri Mar 31 10:57:20 ICT 2023","Fri Mar 31 10:57:20 ICT 2023","0","Regression","Regions","testcases.web.region.RegionListing","testcases.web.region.RegionListing","TC_04","TC_04",""
"broken","Fri Mar 31 11:10:03 ICT 2023","Fri Mar 31 11:10:41 ICT 2023","37284","Regression","Permission","testcases.web.permission.Permission","testcases.web.permission.Permission","TC_15","Verify Reporting user can not view Schedules","Verify Reporting user can not view Schedules"
"broken","Fri Mar 31 11:09:21 ICT 2023","Fri Mar 31 11:10:00 ICT 2023","38967","Regression","Permission","testcases.web.permission.Permission","testcases.web.permission.Permission","TC_04","Verify Reporting user can view the Trip of a 'Feedback'","Verify Reporting user can view the Trip of a 'Feedback'"
"broken","Fri Mar 31 10:51:55 ICT 2023","Fri Mar 31 10:52:31 ICT 2023","36160","Regression","Users","testcases.web.user.UsersCreating","testcases.web.user.UsersCreating","TC_02","Verify user with System write role can create user and add them to a group successfully","Verify user with System write can create user and add them to a group successfully"
"broken","Fri Mar 31 11:13:26 ICT 2023","Fri Mar 31 11:14:03 ICT 2023","36387","Regression","Permission","testcases.web.permission.Permission","testcases.web.permission.Permission","TC_17","Verify Daily Operations Write user can not view Travellers","Verify Daily Operations Write user can not view Travellers"
"passed","Fri Mar 31 11:27:59 ICT 2023","Fri Mar 31 11:28:08 ICT 2023","9221","Regression","Global Search","testcases.web.global_search.GlobalSearch","testcases.web.global_search.GlobalSearch","TC_08","Verify user can search passengers by email","Verify user can search passengers by email"
"broken","Fri Mar 31 11:15:24 ICT 2023","Fri Mar 31 11:16:00 ICT 2023","35798","Regression","Permission","testcases.web.permission.Permission","testcases.web.permission.Permission","TC_41","Verify Configuration Read user can view regions","Verify Configuration Read user can view regions"
"broken","Fri Mar 31 11:14:45 ICT 2023","Fri Mar 31 11:15:21 ICT 2023","35891","Regression","Permission","testcases.web.permission.Permission","testcases.web.permission.Permission","TC_36","Verify System Read user can not edit users","Verify System Read user can not edit users"
"passed","Fri Mar 31 10:52:20 ICT 2023","Fri Mar 31 10:52:38 ICT 2023","18219","Regression","Users","testcases.web.user.UsersCreating","testcases.web.user.UsersCreating","TC_10","Verify user can not create new user with existed email","The Email Address should have a unique constraint against it so the application should never allow a user to create more than one user with the same email address"
"passed","Fri Mar 31 10:54:16 ICT 2023","Fri Mar 31 10:54:35 ICT 2023","19394","Regression","Passenger","testcases.web.passenger.PassengerDeleting","testcases.web.passenger.PassengerDeleting","TC_01","Verify user can delete passenger","Verify user can delete passenger"
"broken","Fri Mar 31 11:16:33 ICT 2023","Fri Mar 31 11:17:08 ICT 2023","35752","Regression","Permission","testcases.web.permission.Permission","testcases.web.permission.Permission","TC_55","Verify Configuration Read user can not edit zone","Verify Configuration Readnot edit zone"
"passed","Fri Mar 31 10:56:18 ICT 2023","Fri Mar 31 10:56:23 ICT 2023","4784","Regression","Regions","testcases.web.region.RegionCreating","testcases.web.region.RegionCreating","TC_01","Verify can create region successfully with valid information","Verify can create region successfully with valid information"
"broken","Fri Mar 31 11:15:00 ICT 2023","Fri Mar 31 11:15:36 ICT 2023","35856","Regression","Permission","testcases.web.permission.Permission","testcases.web.permission.Permission","TC_24","Verify Configuration Write user can not view the 'Feedback' page","Verify Configuration Write user can not view the 'Feedback' page"
"passed","Fri Mar 31 10:53:02 ICT 2023","Fri Mar 31 10:53:32 ICT 2023","29524","Regression","Users","testcases.web.user.UsersEditing","testcases.web.user.UsersEditing","TC_08","Verify can not edit user without invalid email format '@.com.au'","Verify can not edit user without invalid email format '@.com.au'"
"passed","Fri Mar 31 10:51:15 ICT 2023","Fri Mar 31 10:51:15 ICT 2023","454","Regression","Dashboard","testcases.web.dashboard.DashBoard","testcases.web.dashboard.DashBoard","TC_08","Verify can access Bookings page from Dashboard ","Verify can access Bookings page from Dashboard"
"broken","Fri Mar 31 11:13:06 ICT 2023","Fri Mar 31 11:13:42 ICT 2023","35728","Regression","Permission","testcases.web.permission.Permission","testcases.web.permission.Permission","TC_24","Verify System Write user can not view the 'Feedback' page","Verify System Write user can not view the 'Feedback' page"
"broken","Fri Mar 31 11:10:43 ICT 2023","Fri Mar 31 11:11:19 ICT 2023","35888","Regression","Permission","testcases.web.permission.Permission","testcases.web.permission.Permission","TC_14","Verify System Write user can not create new Vehicles","Verify System Write user can not create new Vehicles"
"broken","Fri Mar 31 11:12:46 ICT 2023","Fri Mar 31 11:13:23 ICT 2023","36724","Regression","Permission","testcases.web.permission.Permission","testcases.web.permission.Permission","TC_23","Verify Reporting user can not create new User Group","Verify Reporting user can not create new User Group"
"passed","Fri Mar 31 10:54:16 ICT 2023","Fri Mar 31 10:54:52 ICT 2023","35596","Regression","Passenger","testcases.web.passenger.PassengerEditing","testcases.web.passenger.PassengerEditing","TC_07","Verify user can add Concession: Veteran for passengers","Verify user can add Concession: Veteran for passengers"
"broken","Fri Mar 31 11:12:46 ICT 2023","Fri Mar 31 11:13:23 ICT 2023","36769","Regression","Permission","testcases.web.permission.Permission","testcases.web.permission.Permission","TC_16","Verify Configuration Write user can not view Service Monitoring","Verify Configuration Write user can not view Service Monitoring"
"broken","Fri Mar 31 11:16:02 ICT 2023","Fri Mar 31 11:16:38 ICT 2023","36041","Regression","Permission","testcases.web.permission.Permission","testcases.web.permission.Permission","TC_49","Verify Configuration Read user can not create new region","Verify Configuration Read user can not create new region"
"broken","Fri Mar 31 11:12:02 ICT 2023","Fri Mar 31 11:12:39 ICT 2023","36227","Regression","Permission","testcases.web.permission.Permission","testcases.web.permission.Permission","TC_14","Verify Configuration Read user can not create new Vehicles","Verify Configuration Read user can not create new Vehicles"
"passed","Fri Mar 31 10:53:16 ICT 2023","Fri Mar 31 10:53:33 ICT 2023","16775","Regression","Users","testcases.web.user.UsersCreating","testcases.web.user.UsersCreating","TC_08","Verify can not create user without invalid email format '@.com.au'","Verify can not create user without invalid email format '@.com.au'"
"broken","Fri Mar 31 11:11:23 ICT 2023","Fri Mar 31 11:11:59 ICT 2023","36242","Regression","Permission","testcases.web.permission.Permission","testcases.web.permission.Permission","TC_14","Verify System Read user can not create new Vehicles","Verify System Read user can not create new Vehicles"
"broken","Fri Mar 31 11:10:44 ICT 2023","Fri Mar 31 11:11:21 ICT 2023","36669","Regression","Permission","testcases.web.permission.Permission","testcases.web.permission.Permission","TC_18","Verify System Write user can not create new Travellers","Verify System Write user can not create new Travellers"
"passed","Fri Mar 31 10:51:13 ICT 2023","Fri Mar 31 10:51:14 ICT 2023","922","Regression","Dashboard","testcases.web.dashboard.DashBoard","testcases.web.dashboard.DashBoard","TC_02","Verify can access Zones page from Dashboard ","Verify can access Zones page from Dashboard"
"skipped","Fri Mar 31 10:59:22 ICT 2023","Fri Mar 31 10:59:22 ICT 2023","0","Regression","Zones","testcases.web.zone.ZoneListing","testcases.web.zone.ZoneListing","TC_04","TC_04",""
"passed","Fri Mar 31 11:01:25 ICT 2023","Fri Mar 31 11:01:55 ICT 2023","29883","Regression","Drivers","testcases.web.driver.DriverEditing","testcases.web.driver.DriverEditing","TC_03","Verify edit driver failed with exist email","Verify edit driver failed with exist email"
"broken","Fri Mar 31 10:52:41 ICT 2023","Fri Mar 31 10:53:17 ICT 2023","36295","Regression","Users","testcases.web.user.UsersDeleting","testcases.web.user.UsersDeleting","TC_04","Verify normal user can not delete administrator","Verify normal user can not delete administrator"
"broken","Fri Mar 31 11:14:01 ICT 2023","Fri Mar 31 11:14:37 ICT 2023","35829","Regression","Permission","testcases.web.permission.Permission","testcases.web.permission.Permission","TC_25","Verify System Read user can not view Trips","Verify System Read user can not view Trips"
"passed","Fri Mar 31 11:27:26 ICT 2023","Fri Mar 31 11:27:33 ICT 2023","7334","Regression","Reset password","testcases.web.ResetPassword","testcases.web.ResetPassword","TC_04","Verify send reset password link successfully to email that not registered with the BRIDJ application: ",""
"broken","Fri Mar 31 11:11:24 ICT 2023","Fri Mar 31 11:12:01 ICT 2023","36765","Regression","Permission","testcases.web.permission.Permission","testcases.web.permission.Permission","TC_18","Verify System Read user can not create new Travellers","Verify System Read user can not create new Travellers"
"broken","Fri Mar 31 11:03:03 ICT 2023","Fri Mar 31 11:04:21 ICT 2023","77881","Regression","Booking Flow","testcases.web.booking_flow.BookingFlow","testcases.web.booking_flow.BookingFlow","TC_01","Verify user can book a trip for low tech passenger","Verify user can book a trip for low tech passenger"
"broken","Fri Mar 31 11:10:04 ICT 2023","Fri Mar 31 11:10:40 ICT 2023","36677","Regression","Permission","testcases.web.permission.Permission","testcases.web.permission.Permission","TC_17","Verify Reporting user can not view Travellers","Verify Reporting user can not view Travellers"
"broken","Fri Mar 31 11:10:45 ICT 2023","Fri Mar 31 11:11:21 ICT 2023","36464","Regression","Permission","testcases.web.permission.Permission","testcases.web.permission.Permission","TC_19","Verify System Write user can not view Booking","Verify System Write user can not view Booking"
"passed","Fri Mar 31 10:52:29 ICT 2023","Fri Mar 31 10:52:50 ICT 2023","20875","Regression","Users","testcases.web.user.UsersDeleting","testcases.web.user.UsersDeleting","TC_01","Verify can delete user successfully","Verify can delete user successfully"
"broken","Fri Mar 31 11:12:45 ICT 2023","Fri Mar 31 11:13:21 ICT 2023","36020","Regression","Permission","testcases.web.permission.Permission","testcases.web.permission.Permission","TC_19","Verify Configuration Write user can not view Booking","Verify Configuration Write user can not view Booking"
"broken","Fri Mar 31 11:09:21 ICT 2023","Fri Mar 31 11:10:00 ICT 2023","39208","Regression","Permission","testcases.web.permission.Permission","testcases.web.permission.Permission","TC_10","Verify Reporting user can view trip in VehicleMonitoring","Verify Reporting user can view trip in VehicleMonitoring"
"passed","Fri Mar 31 11:27:59 ICT 2023","Fri Mar 31 11:28:05 ICT 2023","6045","Regression","Global Search","testcases.web.global_search.GlobalSearch","testcases.web.global_search.GlobalSearch","TC_03","Verify user can search drivers by name","Verify user can search drivers by name"
