"Status","Start Time","Stop Time","Duration in ms","Parent Suite","Suite","Sub Suite","Test Class","Test Method","Name","Description"
"broken","Fri Mar 31 10:49:10 ICT 2023","Fri Mar 31 10:49:45 ICT 2023","35684","Regression","Login","testcases.web.Login","testcases.web.Login","TC_Login_01","Verify login successfully with ''","Verify login successfully with 
Email: daily.operation.write@gmail.com
 Password: userPass@123"
"passed","Fri Mar 31 10:52:29 ICT 2023","Fri Mar 31 10:52:58 ICT 2023","29349","Regression","Users","testcases.web.user.UsersEditing","testcases.web.user.UsersEditing","TC_08","Verify can not edit user without invalid email format 'email@.com'","Verify can not edit user without invalid email format 'email@.com'"
"broken","Fri Mar 31 11:13:25 ICT 2023","Fri Mar 31 11:14:02 ICT 2023","36328","Regression","Permission","testcases.web.permission.Permission","testcases.web.permission.Permission","TC_27","Verify System Write user can create new user","Verify System Write user can create new user"
"broken","Fri Mar 31 11:14:45 ICT 2023","Fri Mar 31 11:15:21 ICT 2023","36017","Regression","Permission","testcases.web.permission.Permission","testcases.web.permission.Permission","TC_35","Verify System Write should not be able to delete the 'Administrators' group","Verify System Write should not be able to delete the 'Administrators' group"
"passed","Fri Mar 31 11:01:25 ICT 2023","Fri Mar 31 11:01:55 ICT 2023","29801","Regression","Drivers","testcases.web.driver.DriverEditing","testcases.web.driver.DriverEditing","TC_05","Verify edit driver failed if does not enter last name","Verify edit driver failed if does not enter last name"
"passed","Fri Mar 31 10:51:20 ICT 2023","Fri Mar 31 10:52:05 ICT 2023","45112","Regression","Users","testcases.web.user.UsersEditing","testcases.web.user.UsersEditing","TC_09","Verify user can resubmit the user editing request","When the user clicks Submit, If the creation of a new user fails, the dialog should allow the user to correct any issues and then resubmit the request"
"broken","Fri Mar 31 11:13:22 ICT 2023","Fri Mar 31 11:13:57 ICT 2023","35843","Regression","Permission","testcases.web.permission.Permission","testcases.web.permission.Permission","TC_25","Verify System Write user can not view Trips","Verify System Write user can not view Trips"
"broken","Fri Mar 31 11:12:46 ICT 2023","Fri Mar 31 11:13:23 ICT 2023","36655","Regression","Permission","testcases.web.permission.Permission","testcases.web.permission.Permission","TC_17","Verify Configuration Write user can not view Travellers","Verify Configuration Write user can not view Travellers"
"passed","Fri Mar 31 10:51:59 ICT 2023","Fri Mar 31 10:52:06 ICT 2023","6916","Regression","Users","testcases.web.user.UsersCreating","testcases.web.user.UsersCreating","TC_04","Verify Username, First Name, Last Name, Email Address are mandatory fields for creating user","Verify Username, First Name, Last Name, Email Address are mandatory fields for creating user"
"failed","Fri Mar 31 11:09:13 ICT 2023","Fri Mar 31 11:09:16 ICT 2023","2778","Regression","Booking Flow","testcases.web.booking_flow.BookingFlow","testcases.web.booking_flow.BookingFlow","TC_04","Verify the traveller can be dropped off","Verify the traveller can be dropped off, and booking status can be 'completed'"
"passed","Fri Mar 31 11:02:51 ICT 2023","Fri Mar 31 11:02:56 ICT 2023","4582","Regression","Schedules","testcases.web.schedules.Schedules","testcases.web.schedules.Schedules","TC_01","Verify schedule page show with default region","Verify schedule page show with default region"
"passed","Fri Mar 31 11:01:05 ICT 2023","Fri Mar 31 11:01:16 ICT 2023","10457","Regression","Drivers","testcases.web.driver.DriverCreating","testcases.web.driver.DriverCreating","TC_07","Verify create driver failed if does not enter email name","Verify create driver failed if does not enter email name"
"passed","Fri Mar 31 11:01:06 ICT 2023","Fri Mar 31 11:01:16 ICT 2023","10589","Regression","Drivers","testcases.web.driver.DriverCreating","testcases.web.driver.DriverCreating","TC_04","Verify create driver failed if does not enter first name","Verify create driver failed if does not enter first name"
"broken","Fri Mar 31 11:12:05 ICT 2023","Fri Mar 31 11:12:42 ICT 2023","37068","Regression","Permission","testcases.web.permission.Permission","testcases.web.permission.Permission","TC_15","Verify Configuration Write user can not view Schedules","Verify Configuration Write user can not view Schedules"
"passed","Fri Mar 31 10:54:59 ICT 2023","Fri Mar 31 10:55:43 ICT 2023","44036","Regression","Passenger","testcases.web.passenger.PassengerEditing","testcases.web.passenger.PassengerEditing","TC_09","Verify user can enter credit card details for passenger","Verify user can enter credit card details for passenger"
"broken","Fri Mar 31 11:15:50 ICT 2023","Fri Mar 31 11:16:25 ICT 2023","35772","Regression","Permission","testcases.web.permission.Permission","testcases.web.permission.Permission","TC_46","Verify Configuration Write user can edit zone","Verify Configuration Write edit zone"
"passed","Fri Mar 31 11:19:55 ICT 2023","Fri Mar 31 11:20:06 ICT 2023","11438","Regression","VehicleTrips","testcases.web.vehicle_trips.VehicleTrips","testcases.web.vehicle_trips.VehicleTrips","TC_01","Verify Vehicle Trips page show with default region","Verify Vehicle Trips page show with default region"
"broken","Fri Mar 31 10:55:01 ICT 2023","Fri Mar 31 10:56:09 ICT 2023","68191","Regression","Passenger","testcases.web.passenger.PassengerEditing","testcases.web.passenger.PassengerEditing","TC_03","Verify user can edit the concession for user","Verify user can edit the concession for user"
"passed","Fri Mar 31 10:51:12 ICT 2023","Fri Mar 31 10:51:13 ICT 2023","906","Regression","Dashboard","testcases.web.dashboard.DashBoard","testcases.web.dashboard.DashBoard","TC_09","Verify can access Solutions page from Dashboard ","Verify can access Solutions page from Dashboard"
"broken","Fri Mar 31 11:09:21 ICT 2023","Fri Mar 31 11:09:59 ICT 2023","38193","Regression","Permission","testcases.web.permission.Permission","testcases.web.permission.Permission","TC_01","Verify Reporting user can view the 'Dashboard' page","Verify Reporting user can view the 'Dashboard' page"
"passed","Fri Mar 31 10:58:05 ICT 2023","Fri Mar 31 10:58:23 ICT 2023","18521","Regression","Zones","testcases.web.zone.ZoneDeleting","testcases.web.zone.ZoneDeleting","TC_01","Verify can delete zone successfully","Verify delete zone successfully"
"passed","Fri Mar 31 11:27:58 ICT 2023","Fri Mar 31 11:28:05 ICT 2023","6986","Regression","Global Search","testcases.web.global_search.GlobalSearch","testcases.web.global_search.GlobalSearch","TC_10","Verify user can search vehicle trip by id","Verify user can search vehicle trip by id"
"passed","Fri Mar 31 11:02:22 ICT 2023","Fri Mar 31 11:02:45 ICT 2023","22624","Regression","Vehicles","testcases.web.vehicle.CreateVehicle","testcases.web.vehicle.CreateVehicle","TC_01","Verify user can create new Vehicles","Verify user can create new Vehicles"
"passed","Fri Mar 31 10:52:53 ICT 2023","Fri Mar 31 10:53:11 ICT 2023","17673","Regression","Users","testcases.web.user.UsersCreating","testcases.web.user.UsersCreating","TC_07","Verify can not create user without enter mandatory field 'Last Name'","Verify can not create user without enter mandatory field 'Last Name'"
"passed","Fri Mar 31 11:28:13 ICT 2023","Fri Mar 31 11:28:18 ICT 2023","5626","Regression","Global Search","testcases.web.global_search.GlobalSearch","testcases.web.global_search.GlobalSearch","TC_11","Verify user can search vehicle by id","Verify user can search vehicle by id"
"passed","Fri Mar 31 10:51:20 ICT 2023","Fri Mar 31 10:51:43 ICT 2023","22422","Regression","Users","testcases.web.user.UsersEditing","testcases.web.user.UsersEditing","TC_04","Verify Username, First Name, Last Name, Email Address are mandatory fields for editing user","Verify Username, First Name, Last Name, Email Address are mandatory fields for editing user"
"broken","Fri Mar 31 10:48:32 ICT 2023","Fri Mar 31 10:49:08 ICT 2023","35899","Regression","Login","testcases.web.Login","testcases.web.Login","TC_Login_01","Verify login successfully with ''","Verify login successfully with 
Email: plan.read.user@gmail.com
 Password: userPass@123"
"skipped","Fri Mar 31 11:26:17 ICT 2023","Fri Mar 31 11:26:17 ICT 2023","1","Regression","Service Monitoring","testcases.web.service_monitoring.ServiceMonitoring","testcases.web.service_monitoring.ServiceMonitoring","TC_06","TC_06",""
"broken","Fri Mar 31 11:12:02 ICT 2023","Fri Mar 31 11:12:38 ICT 2023","36288","Regression","Permission","testcases.web.permission.Permission","testcases.web.permission.Permission","TC_01","Verify Configuration Write user can view the 'Dashboard' page","Verify Configuration Write user can view the 'Dashboard' page"
"passed","Fri Mar 31 10:56:16 ICT 2023","Fri Mar 31 10:56:33 ICT 2023","16989","Regression","Regions","testcases.web.region.RegionDeleting","testcases.web.region.RegionDeleting","TC_01","Verify can delete region successfully","Verify delete region successfully"
"passed","Fri Mar 31 10:44:23 ICT 2023","Fri Mar 31 10:44:38 ICT 2023","14240","Regression","LogOut","testcases.web.LogOut","testcases.web.LogOut","TC_02","Verify all open tabs for Operation Portal should be logged out as well after user logs out on one tab","Verify all open tabs for Operation Portal should be logged out as well after user logs out on one tab"
"skipped","Fri Mar 31 11:26:18 ICT 2023","Fri Mar 31 11:26:18 ICT 2023","0","Regression","Service Monitoring","testcases.web.service_monitoring.ServiceMonitoring","testcases.web.service_monitoring.ServiceMonitoring","TC_03","TC_03",""
"broken","Fri Mar 31 11:18:34 ICT 2023","Fri Mar 31 11:19:10 ICT 2023","35767","Regression","Permission","testcases.web.permission.NoPermission","testcases.web.permission.NoPermission","TC_03","Verify permission after removing user from a group","If a user is removed from a group and no longer has access to a privileged role, then the user's access to perform further tasks associated with that role should be revoked instantly"
"broken","Fri Mar 31 11:09:21 ICT 2023","Fri Mar 31 11:10:00 ICT 2023","39227","Regression","Permission","testcases.web.permission.Permission","testcases.web.permission.Permission","TC_06","Verify Reporting user can view Trips","Verify Reporting user can view Trips"
"skipped","Fri Mar 31 10:59:20 ICT 2023","Fri Mar 31 10:59:20 ICT 2023","0","Regression","Zones","testcases.web.zone.ZoneListing","testcases.web.zone.ZoneListing","TC_01","TC_01",""
"passed","Fri Mar 31 10:53:45 ICT 2023","Fri Mar 31 10:54:05 ICT 2023","20282","Regression","Groups","testcases.web.group.GroupEditing","testcases.web.group.GroupEditing","TC_02","Verify can edit group with multiple roles and multiple users","Verify can edit with multiple roles and multiple users"
"broken","Fri Mar 31 11:15:10 ICT 2023","Fri Mar 31 11:15:46 ICT 2023","35796","Regression","Permission","testcases.web.permission.Permission","testcases.web.permission.Permission","TC_39","Verify System Read user can not edit User Group","Verify System Read user can not edit User Group"
"broken","Fri Mar 31 11:14:00 ICT 2023","Fri Mar 31 11:14:36 ICT 2023","35990","Regression","Permission","testcases.web.permission.Permission","testcases.web.permission.Permission","TC_20","Verify System Read user can not view Solutions","Verify System Read user can not view Solutions"
"passed","Fri Mar 31 10:51:09 ICT 2023","Fri Mar 31 10:51:09 ICT 2023","470","Regression","Dashboard","testcases.web.dashboard.DashBoard","testcases.web.dashboard.DashBoard","TC_06","Verify can access Service Monitoring page from Dashboard ","Verify can access Service Monitoring page from Dashboard"
"broken","Fri Mar 31 10:46:39 ICT 2023","Fri Mar 31 10:47:15 ICT 2023","35665","Regression","Login","testcases.web.Login","testcases.web.Login","TC_Login_01","Verify login successfully with ''","Verify login successfully with 
Email: resource.management.read@gmail.com
 Password: userPass@123"
"passed","Fri Mar 31 11:27:59 ICT 2023","Fri Mar 31 11:28:05 ICT 2023","5931","Regression","Global Search","testcases.web.global_search.GlobalSearch","testcases.web.global_search.GlobalSearch","TC_04","Verify user can search drivers by user name","Verify user can search drivers by user name"
"broken","Fri Mar 31 11:10:42 ICT 2023","Fri Mar 31 11:11:18 ICT 2023","36077","Regression","Permission","testcases.web.permission.Permission","testcases.web.permission.Permission","TC_01","Verify System Read user can view the 'Dashboard' page","Verify System Read user can view the 'Dashboard' page"
"broken","Fri Mar 31 11:10:02 ICT 2023","Fri Mar 31 11:10:38 ICT 2023","36025","Regression","Permission","testcases.web.permission.Permission","testcases.web.permission.Permission","TC_11","Verify System Write user can not view Driver","Verify System Write user can not view Driver"
"broken","Fri Mar 31 11:15:20 ICT 2023","Fri Mar 31 11:15:56 ICT 2023","36000","Regression","Permission","testcases.web.permission.Permission","testcases.web.permission.Permission","TC_25","Verify Configuration Write user can not view Trips","Verify Configuration Write user can not view Trips"
"broken","Fri Mar 31 11:09:21 ICT 2023","Fri Mar 31 11:10:00 ICT 2023","38673","Regression","Permission","testcases.web.permission.Permission","testcases.web.permission.Permission","TC_08","Verify Reporting user can edit Trips","Verify Reporting user can edit Trips"
"broken","Fri Mar 31 10:44:46 ICT 2023","Fri Mar 31 10:45:22 ICT 2023","35728","Regression","Login","testcases.web.Login","testcases.web.Login","TC_Login_01","Verify login successfully with ''","Verify login successfully with 
Email: system.write@gmail.com
 Password: userPass@123"
"broken","Fri Mar 31 11:13:54 ICT 2023","Fri Mar 31 11:14:27 ICT 2023","32881","Regression","Permission","testcases.web.permission.Permission","testcases.web.permission.Permission","TC_21","Verify Configuration Write user can not view Users","Verify Configuration Write user can not view Users"
"broken","Fri Mar 31 11:14:03 ICT 2023","Fri Mar 31 11:14:39 ICT 2023","35992","Regression","Permission","testcases.web.permission.Permission","testcases.web.permission.Permission","TC_22","Verify Configuration Write user can not view User Group","Verify Configuration Write user can not view User Group"
"skipped","Fri Mar 31 11:26:18 ICT 2023","Fri Mar 31 11:26:18 ICT 2023","0","Regression","Service Monitoring","testcases.web.service_monitoring.ServiceMonitoring","testcases.web.service_monitoring.ServiceMonitoring","TC_09","TC_09",""
"passed","Fri Mar 31 11:01:28 ICT 2023","Fri Mar 31 11:02:01 ICT 2023","32238","Regression","Drivers","testcases.web.driver.DriverEditing","testcases.web.driver.DriverEditing","TC_08","Verify edit driver successfully without phone number","Verify edit driver successfully without phone number"
"skipped","Fri Mar 31 11:00:37 ICT 2023","Fri Mar 31 11:00:37 ICT 2023","0","Regression","Zones","testcases.web.zone.ZoneListing","testcases.web.zone.ZoneListing","TC_03","TC_03",""
"passed","Fri Mar 31 10:55:01 ICT 2023","Fri Mar 31 10:55:22 ICT 2023","20940","Regression","Passenger","testcases.web.passenger.PassengerEditing","testcases.web.passenger.PassengerEditing","TC_05","Verify user can expire the concession for user","Verify user can expire the concession for user"
"broken","Fri Mar 31 11:09:21 ICT 2023","Fri Mar 31 11:10:00 ICT 2023","38965","Regression","Permission","testcases.web.permission.Permission","testcases.web.permission.Permission","TC_03","Verify Reporting user can view the Traveler of a 'Feedback'","Verify Reporting user with read permission user can view the Traveler of a 'Feedback'"
"broken","Fri Mar 31 11:17:19 ICT 2023","Fri Mar 31 11:17:55 ICT 2023","35705","Regression","Permission","testcases.web.permission.NoPermission","testcases.web.permission.NoPermission","TC_01","Verify permission after removing a group","If a user belongs to a Group and that Group is removed, then the user should no longer have access to perform further tasks related to any privileges that they are no longer associated with, this access should be revoked instantly"
"broken","Fri Mar 31 11:09:21 ICT 2023","Fri Mar 31 11:09:59 ICT 2023","38223","Regression","Permission","testcases.web.permission.Permission","testcases.web.permission.Permission","TC_12","Verify Reporting user can not create new Driver","Verify Reporting user can not create new Driver"
"broken","Fri Mar 31 11:11:13 ICT 2023","Fri Mar 31 11:11:49 ICT 2023","35751","Regression","Permission","testcases.web.permission.Permission","testcases.web.permission.Permission","TC_13","Verify System Read user can not view Vehicles","Verify System Read user can not view Vehicles"
"broken","Fri Mar 31 11:10:04 ICT 2023","Fri Mar 31 11:10:40 ICT 2023","36581","Regression","Permission","testcases.web.permission.Permission","testcases.web.permission.Permission","TC_18","Verify Reporting user can not create new Travellers","Verify Reporting user can not create new Travellers"
"passed","Fri Mar 31 10:52:31 ICT 2023","Fri Mar 31 10:52:49 ICT 2023","18515","Regression","Users","testcases.web.user.UsersCreating","testcases.web.user.UsersCreating","TC_07","Verify can not create user without enter mandatory field 'First Name'","Verify can not create user without enter mandatory field 'First Name'"
"passed","Fri Mar 31 10:56:18 ICT 2023","Fri Mar 31 10:56:38 ICT 2023","20097","Regression","Regions","testcases.web.region.RegionEditing","testcases.web.region.RegionEditing","TC_01","Verify can edit region successfully with valid information","Verify can edit region successfully with valid information"
"broken","Fri Mar 31 11:12:46 ICT 2023","Fri Mar 31 11:13:22 ICT 2023","36073","Regression","Permission","testcases.web.permission.Permission","testcases.web.permission.Permission","TC_18","Verify Configuration Write user can not create new Travellers","Verify Configuration Write user can not create new Travellers"
"broken","Fri Mar 31 11:14:06 ICT 2023","Fri Mar 31 11:14:42 ICT 2023","35977","Regression","Permission","testcases.web.permission.Permission","testcases.web.permission.Permission","TC_23","Verify Configuration Read user can not create new User Group","Verify Configuration Read user can not create new User Group"
"passed","Fri Mar 31 10:52:36 ICT 2023","Fri Mar 31 10:53:08 ICT 2023","31552","Regression","Users","testcases.web.user.UsersDeleting","testcases.web.user.UsersDeleting","TC_03","Verify can create new user that has the same user name and email with a deleted user","Verify can create new user that has the same user name and email with a deleted user"
"broken","Fri Mar 31 11:12:41 ICT 2023","Fri Mar 31 11:13:17 ICT 2023","35941","Regression","Permission","testcases.web.permission.Permission","testcases.web.permission.Permission","TC_20","Verify Reporting user can not view Solutions","Verify Reporting user can not view Solutions"
"broken","Fri Mar 31 11:11:22 ICT 2023","Fri Mar 31 11:11:58 ICT 2023","36117","Regression","Permission","testcases.web.permission.Permission","testcases.web.permission.Permission","TC_11","Verify Configuration Read user can not view Driver","Verify Configuration Read user can not view Driver"
"passed","Fri Mar 31 10:51:12 ICT 2023","Fri Mar 31 10:51:13 ICT 2023","612","Regression","Dashboard","testcases.web.dashboard.DashBoard","testcases.web.dashboard.DashBoard","TC_07","Verify can access Travellers page from Dashboard ","Verify can access Travellers page from Dashboard"
"broken","Fri Mar 31 10:49:47 ICT 2023","Fri Mar 31 10:50:23 ICT 2023","35809","Regression","Login","testcases.web.Login","testcases.web.Login","TC_Login_01","Verify login successfully with ''","Verify login successfully with 
Email: daily.operation.read@gmail.com
 Password: userPass@123"
"broken","Fri Mar 31 11:13:22 ICT 2023","Fri Mar 31 11:14:00 ICT 2023","37416","Regression","Permission","testcases.web.permission.Permission","testcases.web.permission.Permission","TC_22","Verify Configuration Read user can not view User Group","Verify Configuration Read user can not view User Group"
"passed","Fri Mar 31 10:58:09 ICT 2023","Fri Mar 31 10:58:27 ICT 2023","18630","Regression","Zones","testcases.web.zone.ZoneCreating","testcases.web.zone.ZoneCreating","TC_01","Verify can create zone successfully with valid information","Verify can create zone successfully with valid information"
"broken","Fri Mar 31 11:12:05 ICT 2023","Fri Mar 31 11:12:42 ICT 2023","36878","Regression","Permission","testcases.web.permission.Permission","testcases.web.permission.Permission","TC_18","Verify Configuration Read user can not create new Travellers","Verify Configuration Read user can not create new Travellers"
"broken","Fri Mar 31 11:16:42 ICT 2023","Fri Mar 31 11:17:18 ICT 2023","35866","Regression","Permission","testcases.web.permission.Permission","testcases.web.permission.Permission","TC_58","Verify Daily Operations Write user can create new Travellers","Verify Daily Operations Write user can create new Travellers"
"passed","Fri Mar 31 10:51:13 ICT 2023","Fri Mar 31 10:51:14 ICT 2023","494","Regression","Dashboard","testcases.web.dashboard.DashBoard","testcases.web.dashboard.DashBoard","TC_05","Verify can access Schedules page from Dashboard ","Verify can access Schedules page from Dashboard"
"broken","Fri Mar 31 11:11:51 ICT 2023","Fri Mar 31 11:12:27 ICT 2023","35606","Regression","Permission","testcases.web.permission.Permission","testcases.web.permission.Permission","TC_13","Verify Configuration Read user can not view Vehicles","Verify Configuration Read user can not view Vehicles"
"broken","Fri Mar 31 11:10:04 ICT 2023","Fri Mar 31 11:10:41 ICT 2023","37151","Regression","Permission","testcases.web.permission.Permission","testcases.web.permission.Permission","TC_19","Verify Reporting user can not view Booking","Verify Reporting user can not view Booking"
"broken","Fri Mar 31 11:10:42 ICT 2023","Fri Mar 31 11:11:18 ICT 2023","36253","Regression","Permission","testcases.web.permission.Permission","testcases.web.permission.Permission","TC_11","Verify System Read user can not view Driver","Verify System Read user can not view Driver"
"passed","Fri Mar 31 11:16:06 ICT 2023","Fri Mar 31 11:16:29 ICT 2023","23552","Regression","Permission","testcases.web.permission.Permission","testcases.web.permission.Permission","TC_52","Verify Administrators user view zone detail","Verify Administrators user view zone detail"
"broken","Fri Mar 31 11:10:36 ICT 2023","Fri Mar 31 11:11:12 ICT 2023","35804","Regression","Permission","testcases.web.permission.Permission","testcases.web.permission.Permission","TC_13","Verify System Write user can not view Vehicles","Verify System Write user can not view Vehicles"
"broken","Fri Mar 31 11:11:24 ICT 2023","Fri Mar 31 11:12:01 ICT 2023","36824","Regression","Permission","testcases.web.permission.Permission","testcases.web.permission.Permission","TC_16","Verify System Read user can not view Service Monitoring","Verify System Read user can not view Service Monitoring"
"broken","Fri Mar 31 11:14:22 ICT 2023","Fri Mar 31 11:14:58 ICT 2023","36388","Regression","Permission","testcases.web.permission.Permission","testcases.web.permission.Permission","TC_24","Verify Configuration Read user can not view the 'Feedback' page","Verify Configuration Read user can not view the 'Feedback' page"
"broken","Fri Mar 31 11:27:59 ICT 2023","Fri Mar 31 11:28:33 ICT 2023","34292","Regression","Global Search","testcases.web.global_search.GlobalSearch","testcases.web.global_search.GlobalSearch","TC_02","Verify user can search bookings by address","Verify user can search bookings by address"
"passed","Fri Mar 31 10:54:17 ICT 2023","Fri Mar 31 10:54:53 ICT 2023","35385","Regression","Passenger","testcases.web.passenger.PassengerEditing","testcases.web.passenger.PassengerEditing","TC_02","Verify user can add Concession: Child/Youth/Student for passengers","Verify user can add Concession: Child/Youth/Student for passengers"
"broken","Fri Mar 31 11:15:22 ICT 2023","Fri Mar 31 11:15:58 ICT 2023","35899","Regression","Permission","testcases.web.permission.Permission","testcases.web.permission.Permission","TC_40","Verify System Read user can not delete User Group","Verify System Read user can not delete User Group"
"passed","Fri Mar 31 10:58:07 ICT 2023","Fri Mar 31 10:58:41 ICT 2023","34473","Regression","Zones","testcases.web.zone.ZoneEditing","testcases.web.zone.ZoneEditing","TC_01","Verify can edit zone successfully with valid information","Verify can edit zone successfully with valid information"
"passed","Fri Mar 31 11:01:24 ICT 2023","Fri Mar 31 11:01:54 ICT 2023","29983","Regression","Drivers","testcases.web.driver.DriverEditing","testcases.web.driver.DriverEditing","TC_02","Verify edit driver failed with exist user name","Verify edit driver failed with exist user name"
"broken","Fri Mar 31 11:13:26 ICT 2023","Fri Mar 31 11:14:02 ICT 2023","36124","Regression","Permission","testcases.web.permission.Permission","testcases.web.permission.Permission","TC_23","Verify System Read user can not create new User Group","Verify System Read user can not create new User Group"
"passed","Fri Mar 31 10:54:16 ICT 2023","Fri Mar 31 10:54:51 ICT 2023","35500","Regression","Passenger","testcases.web.passenger.PassengerEditing","testcases.web.passenger.PassengerEditing","TC_06","Verify user can add Concession: Senior/Pensioner for passengers","Verify user can add Concession: Senior/Pensioner for passengers"
"failed","Fri Mar 31 11:09:03 ICT 2023","Fri Mar 31 11:09:07 ICT 2023","3792","Regression","Booking Flow","testcases.web.booking_flow.BookingFlow","testcases.web.booking_flow.BookingFlow","TC_03","Verify the traveller can be picked up","Verify the traveller can be picked up, and booking status can be 'in transit'"
