"Status","Start Time","Stop Time","Duration in ms","Parent Suite","Suite","Sub Suite","Test Class","Test Method","Name","Description"
"passed","Fri Mar 31 10:44:40 ICT 2023","Fri Mar 31 10:44:44 ICT 2023","3690","Regression","Login","testcases.web.Login","testcases.web.Login","TC_Login_01","Verify login successfully with 'Full permission user'","Verify login successfully with Full permission user
Email: daohuyt@bridj.com
 Password: userPass@123"
"passed","Fri Mar 31 10:51:13 ICT 2023","Fri Mar 31 10:51:14 ICT 2023","411","Regression","Dashboard","testcases.web.dashboard.DashBoard","testcases.web.dashboard.DashBoard","TC_03","Verify can access Drivers page from Dashboard ","Verify can access Drivers page from Dashboard"
"unknown","Fri Mar 31 11:27:24 ICT 2023","Fri Mar 31 11:27:24 ICT 2023","0","Regression","Reset password","testcases.web.ResetPassword","testcases.web.ResetPassword","TC_02","TC_02",""
"broken","Fri Mar 31 11:12:05 ICT 2023","Fri Mar 31 11:12:42 ICT 2023","36537","Regression","Permission","testcases.web.permission.Permission","testcases.web.permission.Permission","TC_19","Verify Configuration Read user can not view Booking","Verify Configuration Read user can not view Booking"
"passed","Fri Mar 31 10:51:56 ICT 2023","Fri Mar 31 10:52:25 ICT 2023","29406","Regression","Users","testcases.web.user.UsersEditing","testcases.web.user.UsersEditing","TC_08","Verify can not edit user without invalid email format 'email@'","Verify can not edit user without invalid email format 'email@'"
"broken","Fri Mar 31 11:14:46 ICT 2023","Fri Mar 31 11:15:22 ICT 2023","35879","Regression","Permission","testcases.web.permission.Permission","testcases.web.permission.Permission","TC_23","Verify Configuration Write user can not create new User Group","Verify Configuration Write user can not create new User Group"
"passed","Fri Mar 31 10:52:00 ICT 2023","Fri Mar 31 10:52:17 ICT 2023","16938","Regression","Users","testcases.web.user.UsersCreating","testcases.web.user.UsersCreating","TC_05","Verify User Group,Phone Number are not required fields for user creating ","Verify User Group,Phone Number are not required fields for user creating"
"broken","Fri Mar 31 11:16:29 ICT 2023","Fri Mar 31 11:17:05 ICT 2023","35934","Regression","Permission","testcases.web.permission.Permission","testcases.web.permission.Permission","TC_54","Verify Configuration Read user can not create new zone","Verify Configuration Read user can not create new zone"
"broken","Fri Mar 31 11:16:38 ICT 2023","Fri Mar 31 11:17:14 ICT 2023","35820","Regression","Permission","testcases.web.permission.Permission","testcases.web.permission.Permission","TC_56","Verify Configuration Read user can not design zone","Verify Configuration Readnot design zone"
"passed","Fri Mar 31 11:28:13 ICT 2023","Fri Mar 31 11:28:19 ICT 2023","5517","Regression","Global Search","testcases.web.global_search.GlobalSearch","testcases.web.global_search.GlobalSearch","TC_13","Verify user can search vehicle by make","Verify user can search vehicle by make"
"unknown","Fri Mar 31 11:27:24 ICT 2023","Fri Mar 31 11:27:24 ICT 2023","0","Regression","Reset password","testcases.web.ResetPassword","testcases.web.ResetPassword","TC_06","TC_06",""
"broken","Fri Mar 31 11:10:03 ICT 2023","Fri Mar 31 11:10:39 ICT 2023","36259","Regression","Permission","testcases.web.permission.Permission","testcases.web.permission.Permission","TC_14","Verify Reporting user can not create new Vehicles","Verify Reporting user can not create new Vehicles"
"broken","Fri Mar 31 11:14:06 ICT 2023","Fri Mar 31 11:14:42 ICT 2023","36206","Regression","Permission","testcases.web.permission.Permission","testcases.web.permission.Permission","TC_31","Verify System Write user can delete User Group","Verify System Write user can delete User Group"
"broken","Fri Mar 31 11:13:18 ICT 2023","Fri Mar 31 11:13:51 ICT 2023","32938","Regression","Permission","testcases.web.permission.Permission","testcases.web.permission.Permission","TC_21","Verify Configuration Read user can not view Users","Verify Configuration Read user can not view Users"
"passed","Fri Mar 31 10:51:20 ICT 2023","Fri Mar 31 10:51:53 ICT 2023","32611","Regression","Users","testcases.web.user.UsersEditing","testcases.web.user.UsersEditing","TC_07","Verify can not edit user without enter mandatory field 'Username'","Verify can not edit user without enter mandatory field 'Username'"
"skipped","Fri Mar 31 11:26:17 ICT 2023","Fri Mar 31 11:26:17 ICT 2023","0","Regression","Service Monitoring","testcases.web.service_monitoring.ServiceMonitoring","testcases.web.service_monitoring.ServiceMonitoring","TC_05","TC_05",""
"broken","Fri Mar 31 11:11:25 ICT 2023","Fri Mar 31 11:12:01 ICT 2023","36444","Regression","Permission","testcases.web.permission.Permission","testcases.web.permission.Permission","TC_19","Verify System Read user can not view Booking","Verify System Read user can not view Booking"
"broken","Fri Mar 31 11:15:24 ICT 2023","Fri Mar 31 11:16:00 ICT 2023","36048","Regression","Permission","testcases.web.permission.Permission","testcases.web.permission.Permission","TC_42","Verify Configuration Write user can create new region","Verify Configuration Write user can create new region"
"passed","Fri Mar 31 11:01:00 ICT 2023","Fri Mar 31 11:01:35 ICT 2023","35084","Regression","Drivers","testcases.web.driver.DriverEditing","testcases.web.driver.DriverEditing","TC_01","Verify can edit driver successfully with valid information","Verify can edit driver successfully with valid information"
"passed","Fri Mar 31 10:51:20 ICT 2023","Fri Mar 31 10:51:56 ICT 2023","35097","Regression","Users","testcases.web.user.UsersEditing","testcases.web.user.UsersEditing","TC_10","Verify user can not create edit user with existed email","The Email Address should have a unique constraint against it so the application should never allow a user to create more than one user with the same email address"
"skipped","Fri Mar 31 11:26:17 ICT 2023","Fri Mar 31 11:26:17 ICT 2023","0","Regression","Service Monitoring","testcases.web.service_monitoring.ServiceMonitoring","testcases.web.service_monitoring.ServiceMonitoring","TC_04","TC_04",""
"broken","Fri Mar 31 11:14:06 ICT 2023","Fri Mar 31 11:14:43 ICT 2023","36159","Regression","Permission","testcases.web.permission.Permission","testcases.web.permission.Permission","TC_32","Verify System Write should not be able to edit a user belonging to the 'Administrators' group","Verify System Write should not be able to edit a user belonging to the 'Administrators' group"
"skipped","Fri Mar 31 11:26:14 ICT 2023","Fri Mar 31 11:26:14 ICT 2023","0","Regression","Service Monitoring","testcases.web.service_monitoring.ServiceMonitoring","testcases.web.service_monitoring.ServiceMonitoring","TC_08","TC_08",""
"broken","Fri Mar 31 11:11:22 ICT 2023","Fri Mar 31 11:11:58 ICT 2023","36198","Regression","Permission","testcases.web.permission.Permission","testcases.web.permission.Permission","TC_01","Verify Configuration Read user can view the 'Dashboard' page","Verify Configuration Read user can view the 'Dashboard' page"
"broken","Fri Mar 31 11:17:57 ICT 2023","Fri Mar 31 11:18:33 ICT 2023","35566","Regression","Permission","testcases.web.permission.NoPermission","testcases.web.permission.NoPermission","TC_02","Verify permission after removing roles from a group","If a role is removed from a group and a user no longer has access to a privileged role as a result, then all user's within that group will not have access to perform further tasks associated with that role; privileges should be revoked instantly"
"passed","Fri Mar 31 11:01:41 ICT 2023","Fri Mar 31 11:02:03 ICT 2023","21356","Regression","Drivers","testcases.web.driver.DriversListing","testcases.web.driver.DriversListing","TC_04","Verify can select page to show","Verify user can select page to show"
"passed","Fri Mar 31 11:01:06 ICT 2023","Fri Mar 31 11:01:16 ICT 2023","10828","Regression","Drivers","testcases.web.driver.DriverCreating","testcases.web.driver.DriverCreating","TC_03","Verify create driver failed with exist email","Verify create driver failed with exist email"
